{
  "$schema": "https://json-schema.org/draft/2020-12/schema", "$id": "https://elk-guide.local/schemas/scenario.schema.json",
  "title": "Scenario pack declaration v2", "type": "object", "additionalProperties": false,
  "required": ["schema_version", "id", "version", "title", "type", "classification", "difficulty", "estimated_minutes", "brief", "skills", "required_capabilities", "provisioning", "starting_view", "truth", "answer_schema", "playbook", "rubric", "cleanup"],
  "properties": {
    "schema_version": {"const": 2}, "id": {"type": "string", "pattern": "^[a-z][a-z0-9-]+$"}, "version": {"type": "integer", "minimum": 1},
    "title": {"type": "string", "minLength": 1}, "type": {"enum": ["investigation", "analysis", "triage"]}, "classification": {"enum": ["core", "extension", "legacy"]},
    "difficulty": {"type": "integer", "minimum": 1, "maximum": 3}, "estimated_minutes": {"type": "integer", "minimum": 5}, "brief": {"type": "string", "minLength": 1},
    "skills": {"type": "array", "minItems": 1, "items": {"type": "string"}}, "required_capabilities": {"type": "array", "minItems": 1, "items": {"type": "string"}},
    "parameters": {"type": "object", "description": "Declared per-run randomization; each value is a choose/integer/decimal spec or a literal, selected by seed and substituted through ${param.<name>} tokens.", "additionalProperties": {"type": ["object", "array", "string", "number", "boolean"]}},
    "provisioning": {"type": "object", "required": ["strategies", "readiness_validators"], "properties": {"strategies": {"type": "array", "minItems": 1, "items": {"enum": ["seeded-events", "live-traffic", "saved-objects", "managed-resource"]}}, "seeded_events": {"type": "object"}, "live_traffic": {"type": "object"}, "managed_resources": {"type": "array", "items": {"type": "object"}}, "readiness_validators": {"type": "array", "items": {"type": "object", "required": ["id", "kind"]}}}},
    "starting_view": {"type": "object", "required": ["app", "path"], "properties": {"app": {"type": "string"}, "saved_object": {"type": "string"}, "path": {"type": "string", "pattern": "^/app/"}}},
    "truth": {"type": "object", "required": ["answers", "assertions"], "properties": {"answers": {"type": "object"}, "accept": {"type": "object", "additionalProperties": {"type": "array"}}, "assertions": {"type": "array", "minItems": 1, "items": {"type": "object", "required": ["id", "kind"]}}}},
    "answer_schema": {"type": "object", "required": ["type", "fields"], "properties": {"type": {"enum": ["diagnosis", "comparison", "triage_decision"]}, "fields": {"type": "array", "minItems": 1, "items": {"type": "object", "required": ["id", "label", "kind"]}}}},
    "playbook": {"type": "string", "pattern": "^[^/]+\\.json$"}, "rubric": {"type": "string", "pattern": "^[^/]+\\.json$"},
    "cleanup": {"type": "object", "required": ["delete_space", "delete_run_data", "managed_resources"], "properties": {"delete_space": {"const": true}, "delete_run_data": {"const": true}, "managed_resources": {"type": "array"}}},
    "demonstration_conclusion": {"type": "string"}
  }
}
