{"schema_version":2,"id":"regional-outage-map","version":1,"title":"Regional outage map","type":"investigation","classification":"extension","difficulty":2,"estimated_minutes":15,"brief":"Failures cluster geographically. Identify the region and drill into its events.","skills":["maps","spatial-filter","drilldown"],"required_capabilities":["maps","spaces"],"provisioning":{"strategies":["seeded-events"],"seeded_events":{"signal_count":35,"noise_count":100,"signal":{"labels":{"signal":"decisive"},"cloud":{"region":"ap-southeast-2"},"source":{"geo":{"location":{"lat":-33.86,"lon":151.21}}},"event":{"outcome":"failure"},"message":"regional request failure"},"companions":[{"count":3,"event":{"labels":{"corroboration":true},"cloud":{"region":"ap-southeast-2"},"error":{"type":"RegionalGatewayTimeout"},"message":"Sydney gateway timed out"}}]},"readiness_validators":[{"id":"seeded-signal","kind":"es_count","minimum":25,"query":{"term":{"labels.signal.keyword":"decisive"}}}]},"starting_view":{"app":"maps","path":"/app/maps"},"truth":{"answers":{"finding":"ap-southeast-2","scope":"Sydney region","conclusion":"Failures cluster in ap-southeast-2 and drill down to regional gateway timeouts."},"assertions":[{"id":"signal","kind":"es_count","minimum":25,"query":{"term":{"labels.signal.keyword":"decisive"}}},{"id":"corroboration","kind":"es_count","minimum":1,"query":{"term":{"labels.corroboration":true}}}]},"answer_schema":{"type":"diagnosis","fields":[{"id":"finding","label":"Affected region","kind":"string","weight":2},{"id":"scope","label":"Geographic scope","kind":"string","weight":1},{"id":"conclusion","label":"Conclusion","kind":"string","weight":1},{"id":"evidence_refs","label":"Evidence references","kind":"string","scored":false},{"id":"evidence","label":"Map/event evidence","kind":"text","scored":false}]},"playbook":"playbook.json","rubric":"rubric.json","cleanup":{"delete_space":true,"delete_run_data":true,"managed_resources":[]}}
