{"schema_version":2,"id":"dashboard-drilldown-to-evidence","version":2,"title":"Drill down from a dashboard spike","type":"investigation","classification":"core","difficulty":2,"estimated_minutes":15,"brief":"A dashboard chart shows an error spike. Confirm it at document level while preserving its filter and time context.","skills":["chart-interaction","drilldown","discover"],"required_capabilities":["dashboard","discover","spaces","saved_objects"],"parameters":{"window":{"choose":["15m"]}},"provisioning":{"strategies":["seeded-events","saved-objects"],"seeded_events":{"signal_count":35,"noise_count":95,"signal":{"service":{"name":"orders"},"event":{"outcome":"failure"},"http":{"response":{"status_code":500}},"url":{"path":"/checkout"},"message":"orders error spike"},"companions":[{"count":4,"event":{"service":{"name":"orders"},"event":{"outcome":"failure"},"error":{"type":"CheckoutStateConflict"},"message":"document underlying dashboard spike"}}]},"readiness_validators":[{"id":"seeded-signal","kind":"es_count","minimum":25,"query":{"term":{"message.keyword":"orders error spike"}}}]},"starting_view":{"app":"dashboards","saved_object":"incident-overview","path":"/app/dashboards#/view/incident-overview"},"truth":{"answers":{"finding":"orders","scope":"/checkout","conclusion":"The orders error spike on /checkout is confirmed by CheckoutStateConflict documents in the same time and filter context."},"accept":{"scope":["/checkout","checkout"],"error_type":["CheckoutStateConflict"]},"assertions":[{"id":"signal","kind":"es_count","minimum":25,"query":{"term":{"message.keyword":"orders error spike"}}},{"id":"corroboration","kind":"es_count","minimum":1,"query":{"term":{"message.keyword":"document underlying dashboard spike"}}}]},"answer_schema":{"type":"diagnosis","fields":[{"id":"finding","label":"Service behind the spike","kind":"string","weight":2},{"id":"scope","label":"Affected route","kind":"string","weight":1},{"id":"conclusion","label":"Document-level conclusion","kind":"statement","weight":1,"mentions":["finding","error_type"]},{"id":"evidence","label":"Representative event","kind":"text","scored":false}]},"playbook":"playbook.json","rubric":"rubric.json","cleanup":{"delete_space":true,"delete_run_data":true,"managed_resources":[]}}
