{"schema_version":2,"id":"active-alert-triage","version":2,"title":"Active alert triage","type":"triage","classification":"core","difficulty":1,"estimated_minutes":12,"brief":"An alert fired for an unfamiliar service. Decide whether it represents an active customer issue and cite source evidence.","skills":["alert-status","alert-reason","source-pivot"],"required_capabilities":["alerting","spaces"],"provisioning":{"strategies":["seeded-events","managed-resource"],"seeded_events":{"signal_count":36,"noise_count":80,"signal":{"service":{"name":"fulfilment"},"event":{"outcome":"failure"},"http":{"response":{"status_code":503}},"url":{"path":"/shipments"},"message":"customer shipment requests unavailable"},"companions":[{"count":4,"event":{"service":{"name":"fulfilment"},"event":{"outcome":"failure"},"error":{"type":"CarrierGatewayUnavailable"},"message":"carrier gateway rejected active customer request"}}]},"managed_resources":[{"kind":"alert_rule","id":"active-customer-impact","name":"Fulfilment customer failures","interval":"5s"}],"readiness_validators":[{"id":"seeded-signal","kind":"es_count","minimum":25,"query":{"term":{"message.keyword":"customer shipment requests unavailable"}}},{"id":"alert-executed","kind":"kibana_rule_ready","path":"/s/${space_id}/api/alerting/rule/active-customer-impact","timeout_seconds":120}]},"starting_view":{"app":"alerts","path":"/app/observability/alerts"},"truth":{"answers":{"finding":"active","scope":"high priority — fulfilment /shipments","conclusion":"The alert represents an active customer issue because current shipment failures match its condition."},"accept":{"finding":["active","firing","ongoing"],"priority":["high","p1","critical","urgent","sev1"],"service":["fulfilment","fulfillment","/shipments","shipments"],"customer":["customer","customers","user","users","shipment","shipments"]},"assertions":[{"id":"signal","kind":"es_count","minimum":25,"query":{"term":{"message.keyword":"customer shipment requests unavailable"}}},{"id":"corroboration","kind":"es_count","minimum":1,"query":{"term":{"message.keyword":"carrier gateway rejected active customer request"}}},{"id":"isolated","kind":"resource_isolated"}]},"answer_schema":{"type":"triage_decision","fields":[{"id":"finding","label":"Classification","kind":"string","weight":2},{"id":"scope","label":"Priority and scope","kind":"statement","weight":1,"mentions":["priority","service"]},{"id":"conclusion","label":"Decision rationale","kind":"statement","weight":1,"mentions":["finding","customer"]},{"id":"evidence","label":"Alert/source evidence","kind":"text","scored":false}]},"playbook":"playbook.json","rubric":"rubric.json","cleanup":{"delete_space":true,"delete_run_data":true,"managed_resources":["alert_rule"]}}
