{"schema_version":2,"id":"slow-payments","version":3,"title":"Checkout requests are suddenly slow","type":"investigation","classification":"legacy","difficulty":1,"estimated_minutes":12,"brief":"Users report that checkout became slow in the last few minutes. Identify the bottleneck and support the conclusion with correlated request evidence.","skills":["discover","kql","trace-correlation"],"required_capabilities":["discover","spaces","saved_objects"],"provisioning":{"strategies":["live-traffic","saved-objects"],"live_traffic":{"fault":{"service":"payments","type":"latency","delay_ms":3500,"probability":0.85,"paths":["/checkout"]},"traffic":{"entrypoint":"api-gateway","path":"/checkout","requests_per_second":3}},"readiness_validators":[{"id":"affected-traces","kind":"es_cardinality","index":"microservices-*","field":"trace.id.keyword","minimum":10,"timeout_seconds":120,"query":{"bool":{"filter":[{"match_phrase":{"scenario.id":"${run_id}"}},{"match_phrase":{"service.name":"payments"}},{"match_phrase":{"event.type":"transaction"}},{"range":{"event.duration":{"gte":3000000000}}}]}}}]},"starting_view":{"app":"discover","saved_object":"incident-investigation","path":"/app/discover#/view/incident-investigation"},"truth":{"answers":{"finding":"payments","scope":"/checkout","conclusion":"Payments latency is the bottleneck propagating through the checkout request."},"accept":{"scope":["/checkout","checkout"],"latency":["latency","slow","slowness","delay","delayed","bottleneck"]},"assertions":[{"id":"signal","kind":"es_count","index":"microservices-*","minimum":1,"query":{"bool":{"filter":[{"match_phrase":{"scenario.id":"${run_id}"}},{"match_phrase":{"service.name":"payments"}},{"range":{"event.duration":{"gte":3000000000}}}]}}},{"id":"corroboration","kind":"es_count","index":"microservices-*","minimum":1,"query":{"bool":{"filter":[{"match_phrase":{"scenario.id":"${run_id}"}},{"match_phrase":{"event.type":"span"}},{"match_phrase":{"destination.address":"payments"}}]}}}]},"answer_schema":{"type":"diagnosis","fields":[{"id":"finding","label":"Faulty service","kind":"string","weight":2},{"id":"scope","label":"Affected route","kind":"string","weight":1},{"id":"conclusion","label":"Diagnosis","kind":"statement","weight":1,"mentions":["finding","latency"]},{"id":"trace_id","label":"Trace ID","kind":"string","scored":false},{"id":"evidence","label":"Evidence","kind":"text","scored":false}]},"playbook":"playbook.json","rubric":"rubric.json","cleanup":{"delete_space":true,"delete_run_data":true,"managed_resources":[]}}
