{"schema_version":2,"id":"trace-log-correlation","version":1,"title":"Trace-to-log correlation","type":"investigation","classification":"core","difficulty":2,"estimated_minutes":15,"brief":"A failing trace lacks error context. Find the exact application log for the request.","skills":["trace-log-correlation","time-context","document-details"],"required_capabilities":["apm","discover","spaces"],"provisioning":{"strategies":["seeded-events"],"seeded_events":{"signal_count":30,"noise_count":100,"signal":{"service":{"name":"payments"},"event":{"outcome":"failure"},"span":{"name":"authorize card"},"error":{"type":"PaymentDeclined"},"message":"trace span failed without full context"},"companions":[{"count":3,"event":{"processor":{"event":"log"},"event":{"dataset":"payments.log","outcome":"failure"},"service":{"name":"payments"},"log":{"level":"ERROR"},"error":{"type":"IssuerTimeout"},"message":"issuer timed out after authorization deadline"}}]},"readiness_validators":[{"id":"seeded-signal","kind":"es_count","minimum":20,"query":{"term":{"message.keyword":"trace span failed without full context"}}}]},"starting_view":{"app":"apm","path":"/app/apm/services"},"truth":{"answers":{"finding":"issuer timed out after authorization deadline","scope":"payments authorize card","conclusion":"The correlated payment log supplies the decisive IssuerTimeout context for the failing trace."},"assertions":[{"id":"signal","kind":"es_count","minimum":20,"query":{"term":{"message.keyword":"trace span failed without full context"}}},{"id":"corroboration","kind":"es_count","minimum":1,"query":{"term":{"message.keyword":"issuer timed out after authorization deadline"}}}]},"answer_schema":{"type":"diagnosis","fields":[{"id":"finding","label":"Decisive log message","kind":"string","weight":2},{"id":"scope","label":"Trace operation","kind":"string","weight":1},{"id":"conclusion","label":"Correlation conclusion","kind":"string","weight":1},{"id":"evidence","label":"Trace/log evidence","kind":"text","scored":false}]},"playbook":"playbook.json","rubric":"rubric.json","cleanup":{"delete_space":true,"delete_run_data":true,"managed_resources":[]}}
