{"schema_version":2,"id":"memory-leak-and-restarts","version":1,"title":"Memory leak and restarts","type":"investigation","classification":"core","difficulty":2,"estimated_minutes":18,"brief":"A workload becomes unstable over several hours. Find the resource trend and first restart evidence.","skills":["long-time-range","memory","restart-correlation"],"required_capabilities":["infrastructure","spaces"],"provisioning":{"strategies":["seeded-events"],"seeded_events":{"signal_count":44,"noise_count":90,"signal":{"service":{"name":"catalog"},"kubernetes":{"pod":{"name":"catalog-7d8f"}},"metricset":{"name":"memory"},"system":{"memory":{"actual":{"used":{"pct":0.94}}}},"jvm":{"gc":{"count":18}},"message":"memory climbs before workload instability"},"companions":[{"count":2,"offset_seconds":300,"event":{"kubernetes":{"pod":{"name":"catalog-7d8f"}},"kubernetes_container":{"restart_count":1},"event":{"action":"container_restart"},"message":"first catalog pod restart"}}]},"readiness_validators":[{"id":"seeded-signal","kind":"es_count","minimum":30,"query":{"term":{"message.keyword":"memory climbs before workload instability"}}}]},"starting_view":{"app":"metrics","path":"/app/metrics/inventory"},"truth":{"answers":{"finding":"catalog-7d8f","scope":"memory rose to 94% before restart","conclusion":"A sustained memory rise on catalog-7d8f precedes its first restart."},"assertions":[{"id":"signal","kind":"es_count","minimum":30,"query":{"term":{"message.keyword":"memory climbs before workload instability"}}},{"id":"corroboration","kind":"es_count","minimum":1,"query":{"term":{"message.keyword":"first catalog pod restart"}}}]},"answer_schema":{"type":"diagnosis","fields":[{"id":"finding","label":"Affected workload","kind":"string","weight":2},{"id":"scope","label":"Resource trend","kind":"string","weight":1},{"id":"conclusion","label":"Restart conclusion","kind":"string","weight":1},{"id":"evidence","label":"Metric/event evidence","kind":"text","scored":false}]},"playbook":"playbook.json","rubric":"rubric.json","cleanup":{"delete_space":true,"delete_run_data":true,"managed_resources":[]}}
