{"schema_version":2,"id":"esql-cross-service-summary","version":2,"title":"Cross-service incident summary","type":"analysis","classification":"core","difficulty":3,"estimated_minutes":20,"brief":"Produce a concise result table showing volume, failures, and high-percentile latency across services.","skills":["esql","percentiles","service-comparison"],"required_capabilities":["discover","esql","spaces","saved_objects"],"provisioning":{"strategies":["seeded-events","saved-objects"],"seeded_events":{"signal_count":45,"noise_count":130,"signal":{"service":{"name":"payments"},"event":{"outcome":"failure","duration":1400000000},"message":"payment request failed slowly"},"distractors":[{"service":{"name":"orders"},"event":{"outcome":"success","duration":420000000}},{"service":{"name":"catalog"},"event":{"outcome":"success","duration":160000000}}],"companions":[{"count":2,"event":{"summary":{"service":"payments","volume":45,"failures":45,"p95_ms":1400},"message":"cross-service aggregate evidence"}}]},"readiness_validators":[{"id":"seeded-signal","kind":"es_count","minimum":30,"query":{"term":{"message.keyword":"payment request failed slowly"}}}]},"starting_view":{"app":"discover","path":"/app/discover"},"truth":{"answers":{"finding":"payments","scope":"45 failures; p95 1400ms","conclusion":"Payments ranks worst by failures and high-percentile latency."},"accept":{"failures":["45"],"p95":["1400","1.4s","1.4 s"]},"assertions":[{"id":"signal","kind":"es_count","minimum":30,"query":{"term":{"message.keyword":"payment request failed slowly"}}},{"id":"corroboration","kind":"es_count","minimum":1,"query":{"term":{"message.keyword":"cross-service aggregate evidence"}}}]},"answer_schema":{"type":"comparison","fields":[{"id":"finding","label":"Worst service","kind":"string","weight":2},{"id":"scope","label":"Decisive values (failures and p95)","kind":"statement","weight":1,"mentions":["failures","p95"]},{"id":"conclusion","label":"Ranking conclusion","kind":"statement","weight":1,"mentions":["finding"]},{"id":"evidence","label":"Result evidence","kind":"text","scored":false}]},"playbook":"playbook.json","rubric":"rubric.json","cleanup":{"delete_space":true,"delete_run_data":true,"managed_resources":[]}}
