{"schema_version":2,"id":"slo-budget-burn","version":1,"title":"SLO budget burn","type":"triage","classification":"core","difficulty":2,"estimated_minutes":15,"brief":"A service remains above its monthly objective but is consuming budget too quickly. Assess urgency.","skills":["slo-objective","error-budget","burn-rate"],"required_capabilities":["slo","spaces"],"provisioning":{"strategies":["seeded-events","managed-resource"],"seeded_events":{"signal_count":30,"noise_count":170,"signal":{"labels":{"signal":"decisive"},"service":{"name":"checkout"},"event":{"outcome":"failure"},"slo":{"indicator":"availability","burn_rate":8.2},"message":"checkout availability bad event"},"companions":[{"count":3,"event":{"labels":{"corroboration":true},"service":{"name":"checkout"},"slo":{"objective":0.99,"window":"30d","remaining_budget":0.41,"burn_rate":8.2,"driving_period":"last 30 minutes"},"message":"SLO budget and burn evidence"}}]},"managed_resources":[{"kind":"slo","id":"checkout-budget-burn","name":"Checkout availability","target":0.99}],"readiness_validators":[{"id":"seeded-signal","kind":"es_count","minimum":20,"query":{"term":{"labels.signal.keyword":"decisive"}}},{"id":"slo-created","kind":"kibana_api","path":"/s/${space_id}/api/observability/slos/checkout-budget-burn","timeout_seconds":120}]},"starting_view":{"app":"slos","path":"/app/observability/slos"},"truth":{"answers":{"finding":"8.2× burn rate","scope":"checkout availability — last 30 minutes","conclusion":"Urgent: the SLO is still above 99%, but the recent 8.2× burn will exhaust budget rapidly if sustained."},"assertions":[{"id":"signal","kind":"es_count","minimum":20,"query":{"term":{"labels.signal.keyword":"decisive"}}},{"id":"corroboration","kind":"es_count","minimum":1,"query":{"term":{"labels.corroboration":true}}},{"id":"isolated","kind":"resource_isolated"}]},"answer_schema":{"type":"triage_decision","fields":[{"id":"finding","label":"Burn rate","kind":"string","weight":2},{"id":"scope","label":"Indicator and period","kind":"string","weight":1},{"id":"conclusion","label":"Urgency assessment","kind":"string","weight":1},{"id":"evidence_refs","label":"Evidence references","kind":"string","scored":false},{"id":"evidence","label":"SLO evidence","kind":"text","scored":false}]},"playbook":"playbook.json","rubric":"rubric.json","cleanup":{"delete_space":true,"delete_run_data":true,"managed_resources":["slo"]}}
