{"schema_version":2,"id":"slow-dependency-trace","version":2,"title":"Slow dependency trace","type":"investigation","classification":"core","difficulty":1,"estimated_minutes":12,"brief":"Checkout latency is high. Find the downstream dependency and operation responsible.","skills":["apm-services","waterfall","spans"],"required_capabilities":["apm","spaces"],"provisioning":{"strategies":["seeded-events"],"seeded_events":{"signal_count":36,"noise_count":90,"signal":{"service":{"name":"checkout"},"event":{"duration":3700000000},"transaction":{"name":"POST /checkout","duration":{"us":3700000}},"span":{"name":"POST payments/authorize","duration":{"us":3400000},"type":"external"},"destination":{"service":{"resource":"payments"}},"message":"slow checkout transaction"},"companions":[{"count":4,"event":{"service":{"name":"payments"},"event":{"duration":3400000000},"span":{"name":"POST payments/authorize","duration":{"us":3400000}},"message":"slow dependency span"}}]},"readiness_validators":[{"id":"seeded-signal","kind":"es_count","minimum":25,"query":{"term":{"message.keyword":"slow checkout transaction"}}}]},"starting_view":{"app":"apm","path":"/app/apm/services"},"truth":{"answers":{"finding":"payments — POST payments/authorize","scope":"POST /checkout","conclusion":"The payments authorization span dominates the checkout critical path."},"accept":{"dependency":["payments"],"operation":["POST payments/authorize","payments/authorize","authorize"],"scope":["/checkout","checkout"]},"assertions":[{"id":"signal","kind":"es_count","minimum":25,"query":{"term":{"message.keyword":"slow checkout transaction"}}},{"id":"corroboration","kind":"es_count","minimum":1,"query":{"term":{"message.keyword":"slow dependency span"}}}]},"answer_schema":{"type":"diagnosis","fields":[{"id":"finding","label":"Slow dependency and operation","kind":"statement","weight":2,"mentions":["dependency","operation"]},{"id":"scope","label":"Affected transaction","kind":"string","weight":1},{"id":"conclusion","label":"Trace conclusion","kind":"statement","weight":1,"mentions":["dependency","scope"]},{"id":"evidence","label":"Representative trace","kind":"text","scored":false}]},"playbook":"playbook.json","rubric":"rubric.json","cleanup":{"delete_space":true,"delete_run_data":true,"managed_resources":[]}}
