{"schema_version":2,"id":"hot-instance-imbalance","version":1,"title":"Hot instance imbalance","type":"analysis","classification":"core","difficulty":2,"estimated_minutes":15,"brief":"Aggregate service health hides an outlier instance. Identify it and show that its peers remain healthy.","skills":["grouping","sorting","peer-comparison"],"required_capabilities":["infrastructure","spaces"],"provisioning":{"strategies":["seeded-events"],"seeded_events":{"signal_count":40,"noise_count":120,"signal":{"service":{"name":"orders","node":{"name":"orders-04"}},"host":{"name":"orders-04"},"metricset":{"name":"cpu"},"system":{"cpu":{"total":{"norm":{"pct":0.91}}}},"message":"hot orders instance"},"distractors":[{"service":{"name":"orders","node":{"name":"orders-01"}},"host":{"name":"orders-01"},"system":{"cpu":{"total":{"norm":{"pct":0.34}}}}},{"service":{"name":"orders","node":{"name":"orders-02"}},"host":{"name":"orders-02"},"system":{"cpu":{"total":{"norm":{"pct":0.37}}}}}],"companions":[{"count":3,"event":{"peer_comparison":{"outlier":"orders-04","peer_max_cpu_pct":0.39},"message":"peer instances remained healthy"}}]},"readiness_validators":[{"id":"seeded-signal","kind":"es_count","minimum":30,"query":{"term":{"message.keyword":"hot orders instance"}}}]},"starting_view":{"app":"metrics","path":"/app/metrics/inventory"},"truth":{"answers":{"finding":"orders-04","scope":"orders peers below 39% CPU","conclusion":"Orders-04 is the hot outlier while peer instances remain healthy."},"assertions":[{"id":"signal","kind":"es_count","minimum":30,"query":{"term":{"message.keyword":"hot orders instance"}}},{"id":"corroboration","kind":"es_count","minimum":1,"query":{"term":{"message.keyword":"peer instances remained healthy"}}}]},"answer_schema":{"type":"comparison","fields":[{"id":"finding","label":"Outlier instance","kind":"string","weight":2},{"id":"scope","label":"Peer comparison","kind":"string","weight":1},{"id":"conclusion","label":"Imbalance conclusion","kind":"string","weight":1},{"id":"evidence","label":"Metric evidence","kind":"text","scored":false}]},"playbook":"playbook.json","rubric":"rubric.json","cleanup":{"delete_space":true,"delete_run_data":true,"managed_resources":[]}}
