{"schema_version":2,"id":"ml-latency-anomaly","version":1,"title":"Machine-learning latency anomaly","type":"investigation","classification":"extension","difficulty":3,"estimated_minutes":20,"brief":"Investigate a subtle detected latency deviation and its strongest influencer.","skills":["anomaly-explorer","influencers","source-pivot"],"required_capabilities":["machine_learning","spaces"],"provisioning":{"strategies":["seeded-events"],"seeded_events":{"signal_count":28,"noise_count":110,"signal":{"labels":{"signal":"decisive"},"service":{"name":"recommendations"},"event":{"duration":780000000},"ml":{"anomaly_score":82,"influencer":"service.version=7.3.0"},"message":"subtle latency anomaly"},"companions":[{"count":3,"event":{"labels":{"corroboration":true},"service":{"name":"recommendations","version":"7.3.0"},"event":{"duration":780000000},"message":"source latency record for anomaly"}}]},"readiness_validators":[{"id":"seeded-signal","kind":"es_count","minimum":20,"query":{"term":{"labels.signal.keyword":"decisive"}}}]},"starting_view":{"app":"ml","path":"/app/ml/anomaly_detection"},"truth":{"answers":{"finding":"service.version 7.3.0","scope":"recommendations","conclusion":"Version 7.3.0 is the strongest influencer for the recommendations latency anomaly."},"assertions":[{"id":"signal","kind":"es_count","minimum":20,"query":{"term":{"labels.signal.keyword":"decisive"}}},{"id":"corroboration","kind":"es_count","minimum":1,"query":{"term":{"labels.corroboration":true}}}]},"answer_schema":{"type":"diagnosis","fields":[{"id":"finding","label":"Strongest influencer","kind":"string","weight":2},{"id":"scope","label":"Affected service","kind":"string","weight":1},{"id":"conclusion","label":"Anomaly conclusion","kind":"string","weight":1},{"id":"evidence_refs","label":"Evidence references","kind":"string","scored":false},{"id":"evidence","label":"Anomaly/source evidence","kind":"text","scored":false}]},"playbook":"playbook.json","rubric":"rubric.json","cleanup":{"delete_space":true,"delete_run_data":true,"managed_resources":[]}}
