{"schema_version":2,"id":"cpu-saturation","version":1,"title":"CPU saturation","type":"investigation","classification":"core","difficulty":1,"estimated_minutes":12,"brief":"One service slows during a traffic peak. Determine whether compute saturation aligns with the event.","skills":["inventory","entity-filtering","time-correlation"],"required_capabilities":["infrastructure","spaces"],"provisioning":{"strategies":["seeded-events"],"seeded_events":{"signal_count":40,"noise_count":100,"signal":{"service":{"name":"checkout"},"host":{"name":"checkout-03"},"metricset":{"name":"cpu"},"system":{"cpu":{"total":{"norm":{"pct":0.97}}}},"event":{"duration":1100000000},"message":"CPU saturated during checkout latency"},"companions":[{"count":3,"event":{"host":{"name":"checkout-03"},"log":{"level":"WARN"},"message":"request queueing aligned with CPU peak"}}]},"readiness_validators":[{"id":"seeded-signal","kind":"es_count","minimum":30,"query":{"term":{"message.keyword":"CPU saturated during checkout latency"}}}]},"starting_view":{"app":"metrics","path":"/app/metrics/inventory"},"truth":{"answers":{"finding":"checkout-03 at 97% CPU","scope":"checkout","conclusion":"CPU saturation on checkout-03 aligns with the latency interval."},"assertions":[{"id":"signal","kind":"es_count","minimum":30,"query":{"term":{"message.keyword":"CPU saturated during checkout latency"}}},{"id":"corroboration","kind":"es_count","minimum":1,"query":{"term":{"message.keyword":"request queueing aligned with CPU peak"}}}]},"answer_schema":{"type":"diagnosis","fields":[{"id":"finding","label":"Saturated instance","kind":"string","weight":2},{"id":"scope","label":"Service","kind":"string","weight":1},{"id":"conclusion","label":"Time correlation","kind":"string","weight":1},{"id":"evidence","label":"Metric/log evidence","kind":"text","scored":false}]},"playbook":"playbook.json","rubric":"rubric.json","cleanup":{"delete_space":true,"delete_run_data":true,"managed_resources":[]}}
