{"schema_version":2,"id":"service-map-bottleneck","version":1,"title":"Shared service-map bottleneck","type":"investigation","classification":"core","difficulty":2,"estimated_minutes":15,"brief":"Several services are degraded and ownership is unclear. Locate the shared dependency and corroborate it.","skills":["service-map","red-metrics","trace-pivot"],"required_capabilities":["apm","service_map","spaces"],"provisioning":{"strategies":["seeded-events"],"seeded_events":{"signal_count":38,"noise_count":100,"signal":{"labels":{"signal":"decisive"},"service":{"name":"checkout"},"destination":{"service":{"resource":"postgres-orders"}},"event":{"duration":1600000000},"span":{"name":"SELECT orders","type":"db"},"message":"services waiting on shared database"},"companions":[{"count":4,"event":{"labels":{"corroboration":true},"service":{"name":"orders"},"destination":{"service":{"resource":"postgres-orders"}},"span":{"name":"SELECT orders","duration":{"us":1500000}},"message":"trace corroborates shared dependency"}}]},"readiness_validators":[{"id":"seeded-signal","kind":"es_count","minimum":25,"query":{"term":{"labels.signal.keyword":"decisive"}}}]},"starting_view":{"app":"apm","path":"/app/apm/service-map"},"truth":{"answers":{"finding":"postgres-orders","scope":"checkout and orders","conclusion":"The shared postgres-orders dependency is the common bottleneck across degraded services."},"assertions":[{"id":"signal","kind":"es_count","minimum":25,"query":{"term":{"labels.signal.keyword":"decisive"}}},{"id":"corroboration","kind":"es_count","minimum":1,"query":{"term":{"labels.corroboration":true}}}]},"answer_schema":{"type":"diagnosis","fields":[{"id":"finding","label":"Shared dependency","kind":"string","weight":2},{"id":"scope","label":"Affected services","kind":"string","weight":1},{"id":"conclusion","label":"Bottleneck conclusion","kind":"string","weight":1},{"id":"evidence_refs","label":"Evidence references","kind":"string","scored":false},{"id":"evidence","label":"Trace or event evidence","kind":"text","scored":false}]},"playbook":"playbook.json","rubric":"rubric.json","cleanup":{"delete_space":true,"delete_run_data":true,"managed_resources":[]}}
