{"schema_version":2,"id":"esql-before-after-deploy","version":1,"title":"Compare before and after deployment","type":"analysis","classification":"core","difficulty":3,"estimated_minutes":20,"brief":"Quantify whether a release materially changed latency and errors.","skills":["esql","time-bucketing","conditional-aggregation"],"required_capabilities":["discover","esql","spaces","saved_objects"],"provisioning":{"strategies":["seeded-events","saved-objects"],"seeded_events":{"signal_count":48,"noise_count":100,"signal":{"service":{"name":"checkout","version":"5.1.0"},"event":{"outcome":"failure","duration":980000000},"deployment":{"phase":"after"},"message":"post-deploy checkout request degraded"},"distractors":[{"service":{"name":"checkout","version":"5.0.9"},"deployment":{"phase":"before"},"event":{"outcome":"success","duration":180000000}}],"companions":[{"count":2,"event":{"deployment":{"phase":"comparison"},"comparison":{"before_p95_ms":210,"after_p95_ms":980,"before_error_rate":0.02,"after_error_rate":0.31},"message":"before-after aggregate evidence"}}]},"readiness_validators":[{"id":"seeded-signal","kind":"es_count","minimum":30,"query":{"term":{"message.keyword":"post-deploy checkout request degraded"}}}]},"starting_view":{"app":"discover","path":"/app/discover"},"truth":{"answers":{"finding":"5.1.0","scope":"p95 210ms to 980ms; errors 2% to 31%","conclusion":"Release 5.1.0 materially increased both latency and error rate."},"assertions":[{"id":"signal","kind":"es_count","minimum":30,"query":{"term":{"message.keyword":"post-deploy checkout request degraded"}}},{"id":"corroboration","kind":"es_count","minimum":1,"query":{"term":{"message.keyword":"before-after aggregate evidence"}}}]},"answer_schema":{"type":"comparison","fields":[{"id":"finding","label":"Affected release","kind":"string","weight":2},{"id":"scope","label":"Before/after values","kind":"string","weight":1},{"id":"conclusion","label":"Regression conclusion","kind":"string","weight":1},{"id":"evidence","label":"Result evidence","kind":"text","scored":false}]},"playbook":"playbook.json","rubric":"rubric.json","cleanup":{"delete_space":true,"delete_run_data":true,"managed_resources":[]}}
