{"schema_version":2,"id":"retry-amplification","version":1,"title":"Retry amplification","type":"analysis","classification":"core","difficulty":3,"estimated_minutes":20,"brief":"Latency and dependency traffic increased without a matching rise in user traffic. Prove whether retries amplified calls.","skills":["trace-comparison","repeated-spans","critical-path"],"required_capabilities":["apm","spaces"],"provisioning":{"strategies":["seeded-events"],"seeded_events":{"signal_count":32,"noise_count":90,"signal":{"service":{"name":"orders"},"transaction":{"name":"POST /checkout"},"retry":{"count":3},"event":{"duration":1800000000},"message":"checkout transaction with repeated payment calls"},"companions":[{"count":3,"event":{"service":{"name":"orders"},"span":{"name":"POST payments/authorize"},"retry":{"attempt":3,"total_attempts":3},"message":"third repeated dependency span"}}]},"readiness_validators":[{"id":"seeded-signal","kind":"es_count","minimum":20,"query":{"term":{"message.keyword":"checkout transaction with repeated payment calls"}}}]},"starting_view":{"app":"apm","path":"/app/apm/services"},"truth":{"answers":{"finding":"3 payment attempts per request","scope":"orders → payments","conclusion":"Retries triple dependency calls and extend the representative checkout critical path."},"assertions":[{"id":"signal","kind":"es_count","minimum":20,"query":{"term":{"message.keyword":"checkout transaction with repeated payment calls"}}},{"id":"corroboration","kind":"es_count","minimum":1,"query":{"term":{"message.keyword":"third repeated dependency span"}}}]},"answer_schema":{"type":"comparison","fields":[{"id":"finding","label":"Representative retry count","kind":"string","weight":2},{"id":"scope","label":"Amplified dependency path","kind":"string","weight":1},{"id":"conclusion","label":"Amplification conclusion","kind":"string","weight":1},{"id":"evidence","label":"Trace evidence","kind":"text","scored":false}]},"playbook":"playbook.json","rubric":"rubric.json","cleanup":{"delete_space":true,"delete_run_data":true,"managed_resources":[]}}
