{"schema_version":2,"id":"capacity-throughput-saturation","version":2,"title":"Capacity and throughput saturation","type":"analysis","classification":"core","difficulty":3,"estimated_minutes":20,"brief":"Latency rises only above a traffic threshold. Estimate the saturation point from supplied evidence.","skills":["throughput","latency","period-comparison"],"required_capabilities":["dashboard","infrastructure","spaces","saved_objects"],"parameters":{"window":{"choose":["15m"]}},"provisioning":{"strategies":["seeded-events","saved-objects"],"seeded_events":{"signal_count":45,"noise_count":110,"signal":{"service":{"name":"checkout"},"event":{"duration":1200000000},"throughput":{"requests_per_second":240},"capacity":{"saturated":true},"message":"latency above capacity threshold"},"distractors":[{"throughput":{"requests_per_second":180},"event":{"duration":220000000},"capacity":{"saturated":false}}],"companions":[{"count":3,"event":{"capacity":{"threshold_rps":220},"comparison":{"below_ms":230,"above_ms":1200},"message":"throughput-latency threshold evidence"}}]},"readiness_validators":[{"id":"seeded-signal","kind":"es_count","minimum":30,"query":{"term":{"message.keyword":"latency above capacity threshold"}}}]},"starting_view":{"app":"dashboards","saved_object":"incident-overview","path":"/app/dashboards#/view/incident-overview"},"truth":{"answers":{"finding":"220 requests/second","scope":"checkout","conclusion":"Checkout latency rises sharply once throughput exceeds roughly 220 requests per second."},"accept":{"latency":["latency","slow","slower","response time","duration"]},"assertions":[{"id":"signal","kind":"es_count","minimum":30,"query":{"term":{"message.keyword":"latency above capacity threshold"}}},{"id":"corroboration","kind":"es_count","minimum":1,"query":{"term":{"message.keyword":"throughput-latency threshold evidence"}}}]},"answer_schema":{"type":"comparison","fields":[{"id":"finding","label":"Estimated saturation point (requests/second)","kind":"number","weight":2,"tolerance":20},{"id":"scope","label":"Service","kind":"string","weight":1},{"id":"conclusion","label":"Capacity relationship","kind":"statement","weight":1,"mentions":["finding","latency"]},{"id":"evidence","label":"Chart evidence","kind":"text","scored":false}]},"playbook":"playbook.json","rubric":"rubric.json","cleanup":{"delete_space":true,"delete_run_data":true,"managed_resources":[]}}
