{"schema_version":2,"id":"dashboard-incident-triage","version":2,"title":"Dashboard incident triage","type":"triage","classification":"core","difficulty":1,"estimated_minutes":10,"brief":"Use the supplied service overview to rapidly identify the affected region, service, and interval.","skills":["dashboard-filters","controls","legend-filtering"],"required_capabilities":["dashboard","spaces","saved_objects"],"parameters":{"window":{"choose":["15m"]}},"provisioning":{"strategies":["seeded-events","saved-objects"],"seeded_events":{"signal_count":38,"noise_count":90,"signal":{"service":{"name":"checkout"},"cloud":{"region":"eu-west-2"},"event":{"outcome":"failure"},"http":{"response":{"status_code":503}},"message":"regional checkout failure"},"companions":[{"count":3,"event":{"service":{"name":"checkout"},"cloud":{"region":"eu-west-2"},"incident":{"interval":"last 10 minutes"},"message":"dashboard drilldown evidence"}}],"distractors":[{"cloud":{"region":"us-east-1"},"event":{"outcome":"failure"},"http":{"response":{"status_code":503}}},{"cloud":{"region":"eu-west-1"}},{"cloud":{"region":"ap-southeast-1"},"event":{"outcome":"failure"},"http":{"response":{"status_code":500}}}]},"readiness_validators":[{"id":"seeded-signal","kind":"es_count","minimum":25,"query":{"term":{"message.keyword":"regional checkout failure"}}}]},"starting_view":{"app":"dashboards","saved_object":"checkout-regional-overview","path":"/app/dashboards#/view/checkout-regional-overview"},"truth":{"answers":{"finding":"eu-west-2","scope":"checkout","conclusion":"An active checkout incident is isolated to eu-west-2 in the recent interval."},"accept":{"scope":["checkout"]},"assertions":[{"id":"signal","kind":"es_count","minimum":25,"query":{"term":{"message.keyword":"regional checkout failure"}}},{"id":"corroboration","kind":"es_count","minimum":1,"query":{"term":{"message.keyword":"dashboard drilldown evidence"}}}]},"answer_schema":{"type":"triage_decision","fields":[{"id":"finding","label":"Affected region","kind":"string","weight":2},{"id":"scope","label":"Affected service","kind":"string","weight":1},{"id":"conclusion","label":"Triage decision","kind":"statement","weight":1,"mentions":["finding","scope"]},{"id":"evidence","label":"Dashboard evidence","kind":"text","scored":false}]},"playbook":"playbook.json","rubric":"rubric.json","cleanup":{"delete_space":true,"delete_run_data":true,"managed_resources":[]}}
