{
  "schema_version": 2,
  "id": "deployment-version-regression",
  "version": 3,
  "title": "Deployment version regression",
  "type": "investigation",
  "classification": "core",
  "difficulty": 2,
  "estimated_minutes": 15,
  "brief": "Only part of the fleet appears unhealthy after a rolling deployment. Determine whether version is the differentiator and identify its first appearance.",
  "skills": ["multi-value-filtering", "field-comparison", "sorting"],
  "required_capabilities": ["discover", "spaces", "saved_objects"],
  "parameters": {
    "incident": {
      "choose": [
        {"service": "orders", "bad_version": "2.4.1", "good_version": "2.4.0", "status": 500},
        {"service": "payments", "bad_version": "3.2.0", "good_version": "3.1.4", "status": 502},
        {"service": "catalog", "bad_version": "1.9.0", "good_version": "1.8.5", "status": 503},
        {"service": "auth", "bad_version": "4.1.0", "good_version": "4.0.7", "status": 500}
      ]
    },
    "window": {"choose": ["20m", "30m", "45m", "1h"]}
  },
  "provisioning": {
    "strategies": ["seeded-events", "saved-objects"],
    "seeded_events": {
      "signal_count": 35,
      "noise_count": 100,
      "noise_exclude_services": ["${param.incident.service}"],
      "signal": {
        "service": {"name": "${param.incident.service}", "version": "${param.incident.bad_version}"},
        "event": {"outcome": "failure"},
        "http": {"response": {"status_code": "${param.incident.status}"}},
        "transaction": {"result": "HTTP 5xx"},
        "message": "request failed on newly deployed ${param.incident.service} ${param.incident.bad_version}"
      },
      "distractors": [
        {"service": {"name": "${param.incident.service}", "version": "${param.incident.good_version}"}, "event": {"outcome": "success"}, "http": {"response": {"status_code": 200}}}
      ],
      "companions": [
        {
          "count": 26,
          "offset_seconds": 12,
          "interval_seconds": 23,
          "event": {
            "service": {"name": "${param.incident.service}", "version": "${param.incident.good_version}"},
            "event": {"outcome": "success"},
            "http": {"response": {"status_code": 200}},
            "message": "healthy request on previous version ${param.incident.good_version}"
          }
        },
        {
          "count": 2,
          "offset_seconds": 601,
          "event": {
            "service": {"name": "${param.incident.service}", "version": "${param.incident.bad_version}"},
            "event": {"outcome": "failure"},
            "http": {"response": {"status_code": "${param.incident.status}"}},
            "transaction": {"result": "HTTP 5xx"},
            "message": "first unhealthy request from version ${param.incident.bad_version}"
          }
        }
      ]
    },
    "readiness_validators": [
      {"id": "seeded-signal", "kind": "es_count", "minimum": 20, "query": {"term": {"message.keyword": "request failed on newly deployed ${param.incident.service} ${param.incident.bad_version}"}}}
    ]
  },
  "starting_view": {"app": "discover", "saved_object": "incident-investigation", "path": "/app/discover#/view/incident-investigation"},
  "truth": {
    "answers": {
      "finding": "${param.incident.bad_version}",
      "scope": "${param.incident.service}",
      "conclusion": "${param.incident.service} version ${param.incident.bad_version} returned HTTP ${param.incident.status} while ${param.incident.good_version} returned 200, identifying the new version as the regression."
    },
    "accept": {"finding": ["v${param.incident.bad_version}"]},
    "assertions": [
      {"id": "signal", "kind": "es_count", "minimum": 20, "query": {"term": {"message.keyword": "request failed on newly deployed ${param.incident.service} ${param.incident.bad_version}"}}},
      {"id": "corroboration", "kind": "es_count", "minimum": 1, "query": {"term": {"message.keyword": "first unhealthy request from version ${param.incident.bad_version}"}}}
    ]
  },
  "answer_schema": {
    "type": "diagnosis",
    "fields": [
      {"id": "finding", "label": "Affected version", "kind": "string", "weight": 2},
      {"id": "scope", "label": "Service", "kind": "string", "weight": 1},
      {"id": "conclusion", "label": "Comparison conclusion", "kind": "statement", "mentions": ["finding", "scope"], "weight": 1},
      {"id": "evidence", "label": "Version and HTTP status evidence", "kind": "text", "scored": false}
    ]
  },
  "playbook": "playbook.json",
  "rubric": "rubric.json",
  "cleanup": {"delete_space": true, "delete_run_data": true, "managed_resources": []}
}
