{"schema_version":2,"id":"dashboard-panel-inspection","version":1,"title":"Inspect dashboard panel calculations","type":"analysis","classification":"core","difficulty":2,"estimated_minutes":15,"brief":"Two supplied panels seem contradictory. Determine how each metric is calculated and which one answers the incident question.","skills":["panel-inspection","aggregation","filter-scope"],"required_capabilities":["dashboard","spaces","saved_objects"],"provisioning":{"strategies":["seeded-events","saved-objects"],"seeded_events":{"signal_count":40,"noise_count":100,"signal":{"service":{"name":"payments"},"event":{"outcome":"failure"},"panel":{"metric":"failed transactions","scope":"transactions only"},"message":"failed payment transaction"},"companions":[{"count":2,"event":{"panel":{"comparison":"all events includes spans; failed transactions counts transactions"},"message":"panel calculation evidence"}}]},"readiness_validators":[{"id":"seeded-signal","kind":"es_count","minimum":25,"query":{"term":{"message.keyword":"failed payment transaction"}}}]},"starting_view":{"app":"dashboards","saved_object":"incident-overview","path":"/app/dashboards#/view/incident-overview"},"truth":{"answers":{"finding":"failed transactions panel","scope":"transactions only","conclusion":"The panels differ because one counts all events while the decisive panel counts failed transactions only."},"assertions":[{"id":"signal","kind":"es_count","minimum":25,"query":{"term":{"message.keyword":"failed payment transaction"}}},{"id":"corroboration","kind":"es_count","minimum":1,"query":{"term":{"message.keyword":"panel calculation evidence"}}}]},"answer_schema":{"type":"comparison","fields":[{"id":"finding","label":"Decisive panel","kind":"string","weight":2},{"id":"scope","label":"Aggregation scope","kind":"string","weight":1},{"id":"conclusion","label":"Explanation","kind":"string","weight":1},{"id":"evidence","label":"Inspection evidence","kind":"text","scored":false}]},"playbook":"playbook.json","rubric":"rubric.json","cleanup":{"delete_space":true,"delete_run_data":true,"managed_resources":[]}}
